SubOf	WP	Description
WP-301	WP-249	งานทาสีรองพื้นเหล็กรูปพรรณเสากันชน
WP-301	WP-250	งานติดตั้งเสากันชน
WP-301	WP-251	งานทาสีจริงเหล็กรูปพรรณเสากันชน (สีเหลือง 2 สีดำ 3)
WP-301	WP-252	งานติดตั้งเขิบกั้นรถ
WP-301	WP-253	งานทาสีเขิบกั้นรถ (สีเหลือง 3 สีดำ 2)
WP-300	WP-254	งานทำเขิบรอบอาคารและภายในลานโหลด
WP-300	WP-255	งานทาสีเขิบรอบอาคารและภายในลานโหลด
WP-301	WP-256	งานตีเส้นจราจร
	WP-257	งานทำทางเชื่อม
WP-275	WP-258	งานติดตั้งไฟส่องสว่างบริเวณอาคาร
WP-276	WP-259	งานติดตั้งไฟส่องสว่างลานด้านนอก
WP-301	WP-260	งานตัดจ้อยรอบอาคารและลานด้านนอก
WP-301	WP-261	งานหยอดยางมะตอยรอบอาคารและลานด้านนอก
WP-267	WP-262	งานเติมจุลินทรีย์ชุดถังบำบัด
	WP-268	งาน Tower
	WP-269	งานลงเสาเข็ม
	WP-270	งานบ่อซึม
	WP-271	งานระบบไฟฟ้าเมนภายในอาคาร
	WP-272	งานระบบไฟฟ้าเมนภายนอกอาคาร
	WP-273	งานปลั๊กและสวิตช์ไฟภายในอาคาร
	WP-274	งานปลั๊กและสวิตช์ไฟภายนอกอาคาร
	WP-275	งานไฟส่องสว่างบริเวณอาคาร
	WP-276	งานไฟส่องสว่างภายนอกอาคาร
	WP-277	งานพื้นลานด้านหน้า
	WP-278	งานพื้นลานด้านข้าง
	WP-279	งานพื้นลานด้านหลัง
	WP-280	งานพื้นลานโหลด
	WP-281	งานห้องถังน้ำดี
	WP-282	งานแอร์
	WP-283	งานรั้วไวร์แมนและเมทัลชีท
	WP-284	งานประตูลานโหลดด้านนอก
	WP-285	งานประตูลานโหลดด้านใน
	WP-286	งานผนังกระจก หน้าต่าง ประตูบานเลื่อน และประตูออโต้
	WP-287	งานกระเบื้อง
	WP-288	งานหลังคา ครอบ ไซด์ดิ่ง แฟรชชิ่ง ฝ้ามเทัลชีท
	WP-289	งาน Isowall
	WP-290	งานประตู
	WP-291	งานอลูมิเนียมคอมโพสิต
	WP-292	งานกั้นและระบายอากาศ
	WP-293	งานสุขภัณฑ์
	WP-294	งานท่อน้ำเสียภายในอาคาร
	WP-295	งานฝ้าทีบาร์
	WP-296	งานไฟฉุกเฉิน
	WP-297	งานสัญญาณอินเตอร์เน็ต
	WP-298	งานตู้โหลดไฟฟ้า
	WP-299	งานสั่งประกอบ
	WP-300	งานเก็บปูน
	WP-301	งานจราจร
